{
  "brand" : "ACME",
  "item_number" : "69440",
  "category" : "LOCOMOTIVES",
  "scale" : "H0",
  "power_method" : "DC",
  "description" : {
    "it" : "Locomotive elettrica FS E636 351 XMPR Trenitalia prima versione, luci rosse, terzo faro alto, aria condizata, OMR La Spezia",
    "en" : null
  },
  "details" : {
    "it" : null,
    "en" : null
  },
  "delivery_date" : "2014",
  "availability_status" : "AVAILABLE",
  "count" : 1,
  "rolling_stocks" : [ {
    "category" : "LOCOMOTIVE",
    "class_name" : "E636",
    "road_number" : "E636 351",
    "series" : "TERZA SERIE",
    "locomotive_type" : "ELECTRIC_LOCOMOTIVE",
    "railway" : "FS",
    "epoch" : "Vb",
    "livery" : "XMPR",
    "depot" : "La Spezia",
    "dcc_interface" : "MTC_21",
    "control" : "DCC_SOUND",
    "length_over_buffer" : {
      "inches" : null,
      "millimeters" : 210.0
    },
    "technical_specifications" : {
      "minimum_radius" : 360.0,
      "coupling" : {
        "socket" : "NEM_362",
        "close_couplers" : "YES",
        "digital_shunting" : "NO"
      },
      "flywheel_fitted" : "NO",
      "metal_body" : "NO",
      "interior_lights" : "NO",
      "lights" : "YES",
      "spring_buffers" : "NO"
    },
    "is_dummy" : false
  } ]
}