{
  "brand" : "ACME",
  "item_number" : "69128",
  "scale" : "H0",
  "category" : "LOCOMOTIVES",
  "description" : {
    "values" : {
      "it" : "Locomotiva elettrica 646 ??? in livrea verde/grigio con modanature, prese di aria modificate, scalette grandi (69128 DCC Sound)",
      "en" : null
    }
  },
  "details" : {
    "values" : {
      "it" : null,
      "en" : null
    }
  },
  "power_method" : "DC",
  "delivery_date" : "2023",
  "availability_status" : "ANNOUNCED",
  "rolling_stocks" : [ {
    "category" : "LOCOMOTIVE",
    "class_name" : "E646",
    "road_number" : "E646 ???",
    "series" : "SECONDA SERIE",
    "locomotive_type" : "ELECTRIC_LOCOMOTIVE",
    "railway" : "FS",
    "epoch" : "IV",
    "depot" : "",
    "dcc_interface" : "MTC_21",
    "control" : "DCC_SOUND",
    "livery" : "grigio perla/verde magnolia",
    "length_over_buffer" : {
      "inches" : null,
      "millimeters" : 210.0
    },
    "technical_specifications" : {
      "minimum_radius" : 360.0,
      "coupling" : {
        "socket" : "NEM_362",
        "close_couplers" : "YES",
        "digital_shunting" : "NO"
      },
      "flywheel_fitted" : "NO",
      "metal_body" : "NO",
      "interior_lights" : "NO",
      "lights" : "YES",
      "spring_buffers" : "NO"
    },
    "dummy" : false
  } ],
  "count" : 1
}