{
  "brand" : "ACME",
  "item_number" : "60321",
  "scale" : "H0",
  "category" : "LOCOMOTIVES",
  "description" : {
    "values" : {
      "it" : "Locomotiva elettrica FS E424 036 nella livrea castano/isabella, porte frontali, separatore D'Arbela, scalette strette",
      "en" : null
    }
  },
  "details" : {
    "values" : {
      "it" : null,
      "en" : null
    }
  },
  "power_method" : "DC",
  "delivery_date" : "2014",
  "availability_status" : "AVAILABLE",
  "rolling_stocks" : [ {
    "category" : "LOCOMOTIVE",
    "class_name" : "E424",
    "road_number" : "E424 036",
    "series" : "",
    "locomotive_type" : "ELECTRIC_LOCOMOTIVE",
    "railway" : "FS",
    "epoch" : "IIIb",
    "depot" : "",
    "dcc_interface" : "MTC_21",
    "control" : "DCC_READY",
    "livery" : "castano/isabella",
    "length_over_buffer" : {
      "inches" : null,
      "millimeters" : 178.0
    },
    "technical_specifications" : {
      "minimum_radius" : 360.0,
      "coupling" : {
        "socket" : "NEM_362",
        "close_couplers" : "YES",
        "digital_shunting" : "NO"
      },
      "flywheel_fitted" : "NO",
      "metal_body" : "NO",
      "interior_lights" : "NO",
      "lights" : "YES",
      "spring_buffers" : "NO"
    },
    "dummy" : false
  } ],
  "count" : 1
}