{
  "brand" : "ACME",
  "item_number" : "69162",
  "category" : "LOCOMOTIVES",
  "scale" : "H0",
  "power_method" : "DC",
  "description" : {
    "it" : "Locomotiva elettrica FS E646 062 nella livrea verde/grigio, modanature, scalette larghe, prese aria origine, vomere nero",
    "en" : null
  },
  "details" : {
    "it" : "Locomotiva elettrica E 646 062 nella livrea verde magnolia grigio nebbia, con scalette larghe e tientibene lunghi; unica ad aver mantenuto la configurazione delle prese d'aria originali su entrambi i lati sino alla trasformazione in navetta dei primi anni 80'. Edizione limitata",
    "en" : null
  },
  "delivery_date" : "2018",
  "availability_status" : "AVAILABLE",
  "count" : 1,
  "rolling_stocks" : [ {
    "category" : "LOCOMOTIVE",
    "class_name" : "E646",
    "road_number" : "E646 062",
    "series" : "SECONDA SERIE",
    "locomotive_type" : "ELECTRIC_LOCOMOTIVE",
    "railway" : "FS",
    "epoch" : "IVa",
    "livery" : "verde/grigio",
    "depot" : null,
    "dcc_interface" : "MTC_21",
    "control" : "DCC_SOUND",
    "length_over_buffer" : {
      "inches" : null,
      "millimeters" : 210.0
    },
    "technical_specifications" : {
      "minimum_radius" : 360.0,
      "coupling" : {
        "socket" : "NEM_362",
        "close_couplers" : "NO",
        "digital_shunting" : "NO"
      },
      "flywheel_fitted" : "NO",
      "metal_body" : "NO",
      "interior_lights" : "NO",
      "lights" : "YES",
      "spring_buffers" : "NO"
    },
    "is_dummy" : false
  } ]
}